name,attributeGroup,type,multiValue,featureRelevance,relevance,description,exampleValues,allowedValues,recommendedValues,reference
Ausschnittdetails,Passform/Schnitt,STRING,True,PRODUCT_DETAILS,LOW,,"eingefasste Kante, drapiert, geknotet, mit Innerbra, gefüttertes Dekolleté",,,
Herstellerpassform,Passform/Schnitt,STRING,False,PRODUCT_DETAILS,LOW,,"FALKE-Passform, Slim fit, Slim",,,
Rückenlänge,Maßangaben,FLOAT,True,PRODUCT_DETAILS,LOW,,,,,
Seitenlänge,Maßangaben,FLOAT,True,PRODUCT_DETAILS,LOW,,,,,
Zusätzlicher Ausschnitt,Passform/Schnitt,STRING,False,PRODUCT_DETAILS,LOW,,mit Knopf,,,
Ärmeldetails,Passform/Schnitt,STRING,True,PRODUCT_DETAILS,LOW,,"Ärmel mit Ärmelschlitz, angeschnitten, Raglanärmel, eng, mit Ärmelbesatz",,,
Rumpfabschluss,Passform/Schnitt,STRING,False,PRODUCT_DETAILS,LOW,,"normaler Saum, geformtes Bündchen, abgesteppt, Smokbündchen, ohne Bündchen",,,
Cupdetails,Körbchen / Cup,STRING,True,"FILTER, NAVIGATION, SEARCH, PRODUCT_DETAILS",LOW,,"nahtlos vorgeformt, mit Schale, ohne Schale, Spacer, Mittelnaht",,"nicht herausnehmbar, herausnehmbar, nicht gefüttert, gefüttert",
Ärmellänge,Maßangaben,FLOAT,True,PRODUCT_DETAILS,LOW,,,,,
Kapuze,Details,STRING,False,PRODUCT_DETAILS,LOW,,"ohne Kapuze, mit Kapuze",,,
Zusätzlicher Verschluss,Details,STRING,False,PRODUCT_DETAILS,LOW,,"Druckknöpfe im Schritt, Mit Rückenschlitz und Knopf",,,
Ärmelabschluss,Passform/Schnitt,STRING,False,PRODUCT_DETAILS,LOW,,"abgesteppt, Spitze, normaler Saum, abgesteppte Kante, eingefasste Kante",,,
Hosenlänge,Größentext,INTEGER,False,VARIATION_THEME,LOW,,,,,
Serie,Serie,STRING,False,,LOW,,"66 SUPPLY, Zero Feel, Mirage Spotlight",,,
Kragen,Passform/Schnitt,STRING,False,"NAVIGATION, PRODUCT_DETAILS",LOW,,"Stehkragen, ohne Kragen, runder Kragen, Blusenkragen, Rollkragen",,Rollkragen,
Applikationen,Details,STRING,True,PRODUCT_DETAILS,LOW,,"Spitze, Logostickerei, Logodruck, Print, Aufnäher",,,
Sprachen Materialzusammensetzung textiler Bestandteile,Product Compliance,STRING,True,,LOW,,"Französisch (FR), Italienisch (IT), Norwegisch (NO), Türkisch (TR), Englisch (EN)",,,
Erfüllung Brennverhalten nach Ländern,Product Compliance,STRING,True,,LOW,,"Produkt erfüllt die Vorgaben zum Brennverhalten für Großbritannien, Produkt erfüllt die Vorgaben zum Brennverhalten für die Niederlande",,,
Herstelleradresse (EWR) am Produkt,Product Compliance,STRING,False,,LOW,,"Produkt verfügt über eine Kennzeichnung mit der Herstelleradresse (EWR), Produkt verfügt nicht über eine Kennzeichnung mit der Herstelleradresse (EWR)",,,
Sprachen Pflegezusatzinformation Produkt,Product Compliance,STRING,True,,LOW,,"Französisch (FR), Italienisch (IT), Norwegisch (NO), Türkisch (TR), Englisch (EN)",,,
Anzahl Tragevarianten,Passform/Schnitt,INTEGER,False,PRODUCT_DETAILS,LOW,,,,,
Besondere Merkmale,Details,STRING,False,"TITLE, PRODUCT_DETAILS",MEDIUM,,"mit praktischer Druckknopfleiste, mit Druckknöpfen, mit Druckknöpfen im Schritt, mit praktischen Druckknöpfen, im 2er-Pack mit praktischer Druckknopfleiste",,,
Set-Typ,Artikelbezeichnung,STRING,False,,LOW,,"Packung, Set, Spar-Set",,,
Anzahl Teile,Artikelbezeichnung,INTEGER,False,VARIATION_THEME,LOW,,,,,
Rumpfabschlussdetails,Passform/Schnitt,STRING,True,PRODUCT_DETAILS,LOW,,"mit Druckknopf, mit Druckknöpfen, krempelbar, mit Kordelzügen, hinten",,,
Taschen,Details,STRING,True,PRODUCT_DETAILS,LOW,,"Ohne Taschen, Sonnenbrillentasche, Nahttasche, Knopftasche, Paspeltaschen",,,
Größenhinweis,Maßangaben,STRING,False,PRODUCT_DETAILS,LOW,,"Fällt klein aus, bitte eine Größe größer bestellen., Fällt groß aus, bitte eine Größe kleiner bestellen., Fällt eng aus, bitte eine Größe größer bestellen., Fällt sehr weit aus, bitte zwei Größen kleiner bestellen., Fällt sehr klein aus, bitte zwei Größen größer bestellen.",,,
Art Push-up-Effekt,Körbchen / Cup,STRING,True,PRODUCT_DETAILS,LOW,,"mit integriertem Kissen, mit herausnehmbaren Kissen, variabler Push-up Effekt, mit herausnehmbarer Vollschale, durch besondere Schnittform",,,
Farbe Packstück 3,Farbe,STRING,False,"VARIATION_THEME, PRODUCT_DETAILS",LOW,,"petrol, bordeaux, Rautenmuster, seaport, kariert",,,
Formeffekt,Passform/Schnitt,STRING,True,,LOW,,"leicht, mittel, stark",,stark,
Schnittdetails,Passform/Schnitt,STRING,True,PRODUCT_DETAILS,LOW,,"rückenfrei, Abnäher, Einsatz, Falten vorn, Unterbrustband vorn",,,
Produktkennzeichnungen,Product Compliance,STRING,True,,LOW,,"Artikelnummer, Seriennummer, Kennnummer der Partie, Rahmennummer, Typennummer",,,
Schnittform Länge,Passform/Schnitt,STRING,False,"VARIATION_THEME, PRODUCT_DETAILS",MEDIUM,,"kurz, lang, normal, Po-bedeckend, ca. Mitte Oberschenkel",,"3/4-Länge, ca. Mitte Oberschenkel, knieumspielend, mini, kniebedeckend, ca. Mitte Wade, 7/8-Länge, extralang, knöchellang, bodenlang, hüftlang, knöchelfrei, extrakurz, taillenlang, knielang, ca. Mitte Knie, kniefrei, wadenlang, hüftbedeckend, bauchfrei",
Auslieferung,Auslieferung,STRING,False,PRODUCT_DETAILS,LOW,,"liegend, hängend",,,
Stil,Optik/Stil,STRING,False,"FILTER, NAVIGATION, SEARCH, PRODUCT_DETAILS",MEDIUM,,"casual, feminin, sportlich, modisch, elegant",,"modisch, sportlich, klassisch, sexy, casual, elegant, feminin",
Passform,Passform/Schnitt,STRING,False,PRODUCT_DETAILS,LOW,,"figurbetont, sehr figurbetont, Basic, slim fit, tailliert",,,
Materialeigenschaften,Material,STRING,True,"FILTER, NAVIGATION, SEARCH, PRODUCT_DETAILS",LOW,,"pflegeleicht, elastisch, Lycra, Stretch, schnell trocknend",,"schnell trocknend, wärmend, elastisch, wasserabweisend, wärmeisolierend, kühlend, wasserdicht, antibakteriell, windabweisend, winddicht, atmungsaktiv",
Optik,Optik/Stil,STRING,True,PRODUCT_DETAILS,MEDIUM,,"bedruckt, unifarben, gestreift, mehrfarbig, glänzend",,"Paisley, Nadelstreifen, tarnfarben, ethno",
Trägerdetails,Passform/Schnitt,STRING,True,PRODUCT_DETAILS,LOW,,"verstellbar, elastisch, schmal, breit, abnehmbar",,,
Träger,Passform/Schnitt,STRING,False,PRODUCT_DETAILS,LOW,,"mit Träger, Spaghettiträger, Tanktopträger, ohne Träger, one Shoulder",,,
Farbe Packstück 2,Farbe,STRING,False,"VARIATION_THEME, PRODUCT_DETAILS",LOW,,"weiß, gestreift, schwarz, uni, hautfarben",,,
Verschlussdetails,Details,STRING,True,PRODUCT_DETAILS,LOW,,"im Schritt, an der Schulter, hinten, vorn, Schiebeknopf bis Gr. 134",,,
Bügel,Körbchen / Cup,STRING,True,"FILTER, NAVIGATION, SEARCH, PRODUCT_DETAILS",LOW,,"ohne Bügel, mit Bügel, mit seitlichen Stäbchen",,"ohne Bügel, mit Bügel",
Ausschnitt,Passform/Schnitt,STRING,False,PRODUCT_DETAILS,LOW,,"Rundhals, V-Ausschnitt, hoch geschlossener Ausschnitt, tiefer Rundhals, tiefer V-Ausschnitt",,,
Set-Info,Artikelbezeichnung,STRING,True,,LOW,,"2er-Pack, 3er-Pack, 5er-Pack, mit Leggings, mit Schal und Mütze",,,
Größensystem,Größentext,STRING,False,,LOW,,"EU-Größen, US-Größen",,,
Materialart,Material,STRING,False,"VARIATION_THEME, PRODUCT_DETAILS",LOW,,"Jersey, Interlock, Spitze, Single Jersey, Web",,,
Serie Technischer Name,Serie,STRING,False,,LOW,,"LevisBodysuit, MS#000710 Petite fleur gold, MS#012428 Vivance, NSW Woman Printed Stripes, MS#001816 Schiesser",,,
Verschluss,Details,STRING,True,PRODUCT_DETAILS,LOW,,"Druckknopf, Druckknöpfe, Knopfleiste, Haken & Ösen, Knöpfe",,,
Sportgrößen,Größensystem,INTEGER,False,FILTER,LOW,,,"11, 12, 2, 3, 4, 5, 6, 7, 8, 9, 10",,
Anlässe,Allgemein,STRING,True,NAVIGATION,LOW,,"Underwear, Erotik, Casualmode, Basic, Trachtenmode",,"Arbeitsmode, Partymode, Basic, Festival, Festtagsmode, Streetwear, Wintermode, Trachtenmode, Erotik, Fanmode, Abendmode, Herbstmode, Strandmode, Geburt, Hochzeitsmode, Underwear, Sommermode, Casualmode, Businessmode, Frühlingsmode",
Unterbrustumfang,Größensystem,STRING,False,"VARIATION_THEME, TOPINFO, FILTER",LOW,,,"130, 120, 110, 100, 135, 125, 115, 105, 90, 80, 70, 95, 85, 75, 65",,
Ausgabegröße,Größentext,STRING,False,VARIATION_THEME,HIGH,,"62/68, 50/56, 74/80, 86/92, 44",,,
Materialzusammensetzung,Material,STRING,True,"LEGAL, PRODUCT_DETAILS",HIGH,,"100% Baumwolle, 95% Baumwolle, 5% Elasthan, Obermaterial: 90% Polyamid, 10% Elasthan, 100 % Baumwolle, Obermaterial: 100% Baumwolle (Bio-Baumwolle)",,,
Normalgrößen,Größensystem,INTEGER,True,FILTER,LOW,,,"44, 66, 34, 56, 78, 46, 68, 36, 58, 48, 38, 70, 60, 50, 72, 40, 62, 30, 52, 74, 42, 64, 32, 54",,
Material,Material,STRING,False,"VARIATION_THEME, FILTER, NAVIGATION, SEARCH",HIGH,,"Baumwolle, Materialmix, Kunstfaser, Baumwollmischung, Polyamid",,"Daune, Baumwolle, Elasthan, Baumwollmischung",
Grundfarbe,Farbe,STRING,True,FILTER,HIGH,,,"lila, gelb, natur, schwarz, grün, silberfarben, grau, blau, braun, orange, weiß, goldfarben, rot, bunt, rosa",,
Zielgruppe,Allgemein,STRING,False,NAVIGATION,HIGH,,,"zielgruppenunabhängig, Babys, Jugendliche, Kinder, Erwachsene",,
Größentext,Größensystem,STRING,True,,HIGH,,"62 (EU), 50 (EU), 74 (EU), 86 (EU), 44 (EU)",,,
Körbchengröße,Größentext,STRING,False,"VARIATION_THEME, TOPINFO",LOW,,,"Cup D/DD, Cup A/B, Cup DD/E, Cup A/A, Cup D/E/F, Cup C/D, Cup B/C, Cup E/F, Cup A, Cup AA, Cup D/E, Cup G/H, Cup F/G, Cup H, Cup I, Cup F, Cup G, Cup D, Cup E, Cup B, Cup C, Cup L, Cup J, Cup K, Cup A/B/C, Cup DD, Cup AA/A",,
Geschlecht,Allgemein,STRING,False,NAVIGATION,HIGH,,,"neutral, männlich, weiblich",,
Größentyp,Größentext,STRING,False,,LOW,,Normalgrößen,,,
Kurzgrößen,Größensystem,INTEGER,True,FILTER,LOW,,,"22, 33, 23, 34, 24, 35, 25, 26, 16, 27, 17, 28, 18, 29, 19, 30, 20, 31, 21, 32",,
Ärmel,Passform/Schnitt,STRING,False,PRODUCT_DETAILS,MEDIUM,,"Kurzarm, Langarm, ohne Ärmel, 3/4-Ärmel, Halbarm",,,
US-Größen,Größensystem,STRING,True,FILTER,LOW,,,"14XL, 12XL, 10XL, 4XL, 5XL, 6XL, 7XL, 8XL, L, 9XL, M, XXL, XXS, S, XL, XS, XXXL",,
Farbe,Farbe,STRING,False,"VARIATION_THEME, TOPINFO, PRODUCT_DETAILS",HIGH,,"weiß, schwarz, rosa, blau, grau",,,
Pflegehinweise,Material,STRING,False,PRODUCT_DETAILS,HIGH,,"Maschinenwäsche, Schonwäsche, Handwäsche, Reinigung, Lederreinigung",,,
Normalgrößen (Kinder),Größensystem,INTEGER,True,FILTER,MEDIUM,,,"44, 68, 170, 152, 110, 176, 134, 158, 116, 92, 50, 74, 98, 56, 182, 140, 164, 122, 166, 188, 146, 168, 104, 128, 80, 40, 62, 86",,
