name,attributeGroup,type,multiValue,featureRelevance,relevance,description,exampleValues,allowedValues,recommendedValues,reference
Set-Info,Produktdetails,STRING,False,TITLE,LOW,,zwei Ansteckplatten,,,
Set-Typ,Produktdetails,STRING,False,TITLE,LOW,,"Set, Spar-Set",,,
Anzahl Teile,Produktdetails,INTEGER,False,"TITLE, VARIATION_THEME",LOW,,,,,
Serie Technischer Name,Serie,STRING,False,,HIGH,,"Mäusbacher Mio, Mueller Add-On, Venjakob My Home, Mäusbacher Frame, Maja Yolo",,,
Wohnraum,Allgemein,STRING,True,,MEDIUM,,"Esszimmer, Arbeitszimmer, Schlafzimmer, Küche, Wohnzimmer",,,
Serie,Serie,STRING,False,PRODUCT_DETAILS,MEDIUM,,"Mio, Add-On, my home, Frame, Sky",,,
Durchmesser,Maßangaben,FLOAT,False,"VARIATION_THEME, PRODUCT_DETAILS",LOW,,,,,
Herstellergarantie,Wissenswertes,STRING,False,PRODUCT_DETAILS,LOW,,"5 Jahre gemäß den Garantie-Bedingungen, 8  Jahre gemäß den Garantie-Bedingungen, 6 Jahre gemäß den Garantie-Bedingungen, 10 Jahre gemäß den Garantie-Bedingungen, 9 Jahre gemäß den Garantie-Bedingungen",,,
Oberflächenoptik,Optik/Stil,STRING,False,"VARIATION_THEME, PRODUCT_DETAILS",LOW,,"matt, glänzend, hochglänzend, Klavierlackoptik, seidenmatt",,,
Materialhinweis,Material,STRING,True,PRODUCT_DETAILS,LOW,,"Das Label des FSC® weist nach, dass Sie mit dem Kauf dieser Produkte vorbildliche Waldwirtschaft - nach den strengen ökologischen, sozialen und wirtschaftlichen Standards des Forest Stewardship Council® - fördern und die Waldressourcen schonen., enthält nichttextile Teile tierischen Ursprungs",,,
Breite,Maßangaben,FLOAT,False,"VARIATION_THEME, PRODUCT_DETAILS",HIGH,,,,,
Markeninformationen,Produktdetails,STRING,False,PRODUCT_DETAILS,LOW,,"Seit 2001 begeistert uns Home affaire mit Landhausmöbeln zum Verlieben. Ob modern, romantisch oder natürlich traditionell – der Fantasie für wunderschönes Einrichten sind kaum Grenzen gesetzt., Vorsprung durch Design und Qualität. Dafür steht der Name VENJAKOB. Seit über 75 Jahren zeichnet dies die Firma aus. Sie verbindet Vision, Innovation und Inspiration. Aber auch Tradition, denn was 1935 in Gütersloh mit einem kleinen Tischlerbetrieb begann, hat sich bis heute zu einem der führenden deutschen Möbelunternehmen entwickelt., SMALL LIVING auf engstem Raum - Nicht nur New York oder London, auch in München, Freiburg und Berlin wird Wohnraum immer knapper und teurer. Mieten von 15 oder gar 20 Euro je Quadratmeter sind inzwischen längst keine Seltenheit mehr. Kein Wunder, dass viele Menschen nach kleineren Wohnungen suchen und dass kompaktes Wohnen in so genannten Mikro-Appartements nicht nur bei Student*innen voll im Trend liegt. Viele dieser neuen Wohnungen sind lediglich 20 bis 30 Quadratmeter groß, entsprechend wichtig werden daher intelligente Grundrissgestaltung sowie maximal komprimierte Innenausstattung.<br />Müller SMALL LIVING steht für zeitlos moderne Möbel, die insbesondere für das urbane Wohnen auf begrenzter Fläche konzipiert sind. Das Produktprogramm wird komplett am eigenen Firmensitz im friesischen Bockhorn gefertigt. Es umfasst multifunktionale, flexible und modular erweiterbare Möbel, die nicht nur in großen Altbau-Lofts, sondern auch in kleineren Wohnungen funktionieren. Das 1869 gegründete Familienunternehmen ist mittlerweile in fünfter Generation tätig. Seit Ende der 1960er-Jahre setzt Müller SMALL LIVING auf industrielle Serienproduktion und auf die Zusammenarbeit mit Designern wie Rolf Heide, Jan Armgardt, kaschkasch, Michael Hilgers oder Felix Stark. Bekannt ist insbesondere die gemeinsam mit Rolf Heide entwickelte Stapelliege., andas Nordic Interior: Bringen Sie skandinavische Leichtigkeit in Ihr Zuhause. andas vereint reduziertes klares Design, freundliche Farben und eine hochwertige Verarbeitung. Ausgewählte Hölzer und hochwertige Materialien sorgen für Wärme und Natürlichkeit. Die harmonische Ausstrahlung der Möbel lässt Platz für die individuelle Gestaltung Ihres Lebensraumes. Die Möbel von andas lassen sich einfach mit anderen Stilen kombinieren, unterstreichen die Wirkung des Raumes und bereichern ihn um skandinavisches Lebensgefühl., Es gibt Entscheidungen im Leben, die wichtiger sind als andere. Meilensteine, die größere Bedeutung für den Alltag erlangen, als man sich zunächst vorstellen kann. Ihr erster Stressless® Bequemsessel kann gut und gerne einer dieser Schlüsselmomente sein, die ein Vorher und ein Nachher definieren. Über die Jahrzehnte hinweg haben alle Stressless® Möbelentwürfe eines gemeinsam gehabt: Diese einzigartige Erfahrung von Komfort.<br /><br />Es ist uns wichtig, dass Ihr Stressless® Ihnen maximalen Komfort bietet. Deshalb stellen wir unsere Modelle meistens in 2 oder 3 Größen her - für eine optimale Passform.",,,
Besondere Merkmale,Produktdetails,STRING,False,TITLE,LOW,,"(48 cm), kratzfest durch Melaminharbeschichtung, aus massivem Wildeichenholz, in zwei unterschiedlichen Farben, passend für den Esstisch »Model 1«, FLAI Add-On-Element No.5, passend für die Betten »FLAI« und »PLANE«, aus schönem massivem Wildeichenholz, Breite 50 cm",,,
Hinweis Lieferumfang,Lieferung & Montage,STRING,True,PRODUCT_DETAILS,LOW,,"Aufbauanleitung, Montagematerial",,,
Themen,Allgemein,STRING,True,PRODUCT_DETAILS,LOW,,"Erste eigene Wohnung, Wohnidee-Haus",,,
Gewicht,Maßangaben,FLOAT,False,PRODUCT_DETAILS,LOW,,,,,
Lieferumfang,Lieferung & Montage,STRING,True,PRODUCT_DETAILS,LOW,,"Aufbauanleitung, Montagematerial",,,
Farbe,Farbe,STRING,False,"VARIATION_THEME, TOPINFO, PRODUCT_DETAILS",HIGH,,"weiß, eichefarben/eichefarben, asteiche, Kernbuche, eichefarben/graphit",,,
Höhe,Maßangaben,FLOAT,False,"VARIATION_THEME, PRODUCT_DETAILS",HIGH,,,,,
Tiefe,Maßangaben,FLOAT,False,"VARIATION_THEME, PRODUCT_DETAILS",HIGH,,,,,
Materialzusammensetzung,Material,STRING,False,PRODUCT_DETAILS,LOW,,,,,
Ergänzende Maßangaben,Maßangaben,STRING,False,PRODUCT_DETAILS,LOW,,"Höhe einstellbar von 70 bis 80 cm, Die Tischplatte aus Massivholz ist ein 100%iges Naturprodukt und „lebt“ bzw. „arbeitet“. Die Breite kann um ca.2-3mm variieren. Aufgrund der Faserrichtung ist es gewollt und kein Reklamationsgrund.",,,
Oberflächenbeschichtung,Optik/Stil,STRING,False,"VARIATION_THEME, PRODUCT_DETAILS",LOW,,"melaminharzbeschichtet, melaminbeschichtet, pulverbeschichtet, furniert, PCV-Tiefziehfront",,,
Art Herstellung,Wissenswertes,STRING,False,PRODUCT_DETAILS,LOW,,"maschinell, handgefertigt",,,
Material,Material,STRING,False,"VARIATION_THEME, FILTER, PRODUCT_DETAILS",LOW,,"Holzwerkstoff, Massivholz, Stahl, Metall, MDF",,,
Wohnstil,Allgemein,STRING,True,PRODUCT_DETAILS,LOW,,"Modern, Scandi, Landhaus, Klassik, Industrial",,,
Lieferzustand,Lieferung & Montage,STRING,False,PRODUCT_DETAILS,LOW,,"zerlegt, montiert, teilmontiert, nur Füße zu montieren, teilmontiert, teilmontiert, nur einhaken und Füße montieren",,,
Pflegehinweise,Hinweise,STRING,True,PRODUCT_DETAILS,LOW,,"Bitte beachten Sie die Pflegehinweise gemäß dem beiliegenden Produkt- und Materialpass., pflegeleicht, feucht abwischbar, trocken abwischbar",,,
Hinweis Zubehör,Hinweise,STRING,True,PRODUCT_DETAILS,LOW,,"Wir empfehlen den passenden Esstisch (Artikelnummer: 79718349), Zur Erweiterung auf 228 cn für denTisch, Art.-Nr. 28528009, Zur Erweiterung für den Esstisch 180x 90 cm, Art.-Nr.42673848, Servicebox je Kommission, Zur Erweiterung auf eine Breite von 228 cm für den Tisch, Art.-Nr. .4557 0067.",,,
Oberflächenbehandlung,Optik/Stil,STRING,False,"VARIATION_THEME, PRODUCT_DETAILS",LOW,,"lackiert, geölt, antikisiert, lasiert, bedruckt",,,
Aufbauhinweise,Lieferung & Montage,STRING,True,PRODUCT_DETAILS,LOW,,"Inklusive Aufbau – und Premiumservice, einfache Selbstmontage mit Aufbauanleitung, Für eine Wandmontage wird zusätzliches Montagematerial benötigt., Leiter beidseitig montierbar, Stauraum wahlweise links oder rechts montierbar",,,
Holzart,Material,STRING,False,"VARIATION_THEME, PRODUCT_DETAILS",LOW,,"Eiche, Wildeiche, Kernbuche, Cedro, Weide",,,
Oberflächenbearbeitung,Optik/Stil,STRING,False,"VARIATION_THEME, PRODUCT_DETAILS",LOW,,"gebürstet, ummantelt, gefräst, geriffelt, geschliffen",,,
Relevanz Batteriegesetz,Product Compliance,STRING,False,,LOW,,"Produkt fällt nicht unter das Batteriegesetz, Produkt fällt unter das Batteriegesetz",,,
CE-Kennzeichnung am Produkt,Product Compliance,STRING,False,,LOW,,"Produkt verfügt nicht über eine CE-Kennzeichnung, Produkt verfügt über eine CE-Kennzeichnung",,,
Sprachen Bedienungs-/Aufbauanleitung,Product Compliance,STRING,True,,LOW,,"Deutsch (DE), Aufbauanleitung ausschließlich durch Zeichnung ausgeführt, Französisch (FR), Italienisch (IT), Englisch (EN)",,,
Relevanz Energieverbrauchskennzeichnungsverordnung,Product Compliance,STRING,False,,LOW,,"Produkt fällt nicht unter die Energieverbrauchskennzeichnungsverordnung, Produkt fällt unter die Energieverbrauchskennzeichnungsverordnung",,,
Grundfarbe,Farbe,STRING,True,FILTER,HIGH,,,"lila, gelb, natur, schwarz, grün, silberfarben, grau, blau, braun, orange, weiß, goldfarben, rot, bunt, rosa",,
Zielgruppe,Allgemein,STRING,True,NAVIGATION,LOW,,,"zielgruppenunabhängig, Babys, Jugendliche, Kinder, Erwachsene",,
Herstelleradresse (EWR) am Produkt,Product Compliance,STRING,False,,LOW,,"Produkt verfügt über eine Kennzeichnung mit der Herstelleradresse (EWR), zu bearbeiten, Produkt verfügt nicht über eine Kennzeichnung mit der Herstelleradresse (EWR)",,,
Sprachen am Produkt,Product Compliance,STRING,True,,LOW,,"Deutsch (DE), Englisch (EN), Französisch (FR), Norwegisch (NO), Italienisch (IT)",,,
Geschlecht,Allgemein,STRING,False,NAVIGATION,LOW,,,"neutral, männlich, weiblich",,
Relevanz CE-Pflicht,Product Compliance,STRING,False,,LOW,,"Produkt fällt nicht unter die CE-Pflicht, Produkt fällt unter die CE-Pflicht",,,
Relevanz Gefahrgut,Product Compliance,STRING,False,,LOW,,"Produkt fällt nicht unter die Gefahrgutvorschriften., Produkt fällt unter die Gefahrgutvorschriften., Produkt fällt unter die Gefahrgutvorschriften gemäß Sicherheitsdatenblatt (Abschnitt 14).",,,
Relevanz WEEE-Richtlinie,Product Compliance,STRING,False,,LOW,,"Produkt fällt nicht unter die WEEE-Richtlinie, Produkt fällt unter die WEEE-Richtlinie",,,
Typ Netzstecker,Product Compliance,STRING,False,,LOW,,"kein Netzanschluss vorhanden, Netzdirektanschluss, CEE-Drehstromstecker, Schutzkontaktstecker (Typ F-CEE 7/4), Konturenstecker (Typ C-CEE 7/17)",,,
Produktkennzeichnungen,Product Compliance,STRING,True,,LOW,,"Artikelnummer, Chargennummer, Seriennummer, Typennummer, Kennnummer der Partie",,,
