name,attributeGroup,type,multiValue,featureRelevance,relevance,description,exampleValues,allowedValues,recommendedValues,reference
Farbe Packstück 3,Farbe,STRING,False,"VARIATION_THEME, PRODUCT_DETAILS",LOW,,"weiß, meliert, schwarz, rosa, grau",,,
Art Push-up-Kissen,Körbchen / Cup,STRING,False,PRODUCT_DETAILS,LOW,,"Schaumstoffkissen, Gelkissen, Volumenkissen mit Wasser-Öl-Gemisch, Air-Kissen, Silikonkissen",,,
Herstellerpassform,Passform/Schnitt,STRING,False,PRODUCT_DETAILS,LOW,,"tight fit, Kompressionspassform, Kompressionspassform mit leichtem Halt, Eng anliegend geschnitten, Kompressionspassform; mittlerer Halt",,,
Serie,Serie,STRING,False,PRODUCT_DETAILS,LOW,,"Zero Feel, Wow Embrace, Palm Spotlight, AN-310, Mirage Spotlight",,,
Set-Typ,Artikelbezeichnung,STRING,False,,LOW,,"Packung, Set, Spar-Set",,,
Dekolletédetails,Dekolleté,STRING,True,PRODUCT_DETAILS,LOW,,"gefüttertes Dekolleté, vorgeformte Cups, mit Stillmöglichkeit, eingearbeitete BH-Schalen, mit Brustverstärkung",,,
Stillfunktion,Funktionen,STRING,False,PRODUCT_DETAILS,LOW,,"BH vorn zu öffnen, BH seitlich zu öffnen",,,
Schnittform,Passform/Schnitt,STRING,False,"NAVIGATION, PRODUCT_DETAILS",LOW,,"Balconette, Bustier, Bandeau, Triangel, High-Apex-BH",,"Triangel, Balconette, Bandeau",
Optik,Optik/Stil,STRING,True,PRODUCT_DETAILS,LOW,,"unifarben, glänzend, bedruckt, mehrfarbig, meliert",,"gestreift, kariert, Paisley, Batikmuster, Nadelstreifen, tarnfarben, ethno, animal-print",
Materialart,Material,STRING,False,"VARIATION_THEME, FILTER, NAVIGATION, SEARCH, PRODUCT_DETAILS",LOW,,"Spitze, Microtouch, Jersey, Stoff, Netz",,Spitze,
Anzahl Tragevarianten,BH-Träger,INTEGER,False,PRODUCT_DETAILS,LOW,,,,,
Verschlussdetails,Verschluss,STRING,False,PRODUCT_DETAILS,LOW,,"hinten, vorn, seitlich, Schiebeknopf bis Gr. 134, mit Windschutzblende",,,
Auslieferung,Auslieferung,STRING,False,PRODUCT_DETAILS,LOW,,"liegend, hängend",,,
Dekolleté,Dekolleté,STRING,False,PRODUCT_DETAILS,LOW,,"Rundhals, V-Ausschnitt, Balconnet, U-Boot-Ausschnitt, herzförmiger Ausschnitt",,,
Material Bügel,Material,STRING,False,PRODUCT_DETAILS,LOW,,"Kunststoff, Gel, Metall, Silikon",,,
Herstellertechnologien,Material,STRING,True,"FILTER, NAVIGATION, SEARCH, PRODUCT_DETAILS",LOW,,"SpeedWick, COOLMAX®, AEROREADY, Dri-FIT, climacool®",,"AEROREADY, DOWN, SNAP-IN-SYSTEM, climacool®, EXTRA-LONG SYSTEM ZIP, windCELL, RAIN.RDY, ALTAI FLEECE MEDIUM, NANUK 200, MICROGUARD MAXLOFT, Fubu tex, TECNOPILE®, Dri-FIT, MICROGUARD SILVER, SOFT SHELL STRETCH, PFC FREE, DOWNFIBER, TEXAPORE Stretch, SNUGGLE UP, HIGH QUALITY DOWN, STORMLOCK, UPF Protection 30, WIND.RDY, TEXAPORE 4x4, Vent Pro System, COLD.RDY, MICROGUARD MAXLOFT Q.M.C., Kids/Youth System Zip, UV SHIELD, climaproof®, PlayWarm, powerCELL, climalite® Cotton, ALTAI FLEECE SUPER WARM, ColdGear®, 3-in-1 SYSTEM REGULAR, ARMATECH PLUS, VENTBREAK, TEXAPORE O2, 3-in-1 SYSTEM SHORT, FIBERCLOUD, Stormlock Hyproof, bluesign®, S. CAFÉ®, UPF Protection 15, FAIR WEAR FOUNDATION, THINSULATE, climachill™, coolCELL, FUNCTION 65, NANUK 100, ALTAI FLEECE MICRO, NANUK 300, dryCELL, HyVent®, Regular Zip for System Jackets, Polartec®, ZipIn!, NANUK 150, VENTLOFT, WINDSTOPPER®, QuickDry, TEXAPORE, UPF Protection 50, UV-PROTECTION, PlayIce, climalite®, PlayShield, ACS TIGHT, S-FRESH, climaheat™, HEAT.RDY, NANUK DYNAMIC, TECNOWOOL, Allseasongear®, Q.M.C., GORE-TEX®, SUPPLEX®, techfit™, ACS, Short Zip for System Jackets, Stormlock Active, DRYNETIC, warmCELL, PRIMALOFT® BLACK ECO, climalite®+, climawarm®, VENTURI",
Empfohlen für Cupgröße,Passform/Schnitt,STRING,True,PRODUCT_DETAILS,LOW,,"A-B, A-C, B-C, B-D, ca. A-B",,,
Passform,Passform/Schnitt,STRING,False,PRODUCT_DETAILS,LOW,,"sehr figurbetont, comfort fit, slim fit, figurbetont, Basic",,,
Größentyp,Maßangaben,STRING,False,,LOW,,Normalgrößen,,,
Funktionen,Funktionen,STRING,False,"VARIATION_THEME, NAVIGATION, PRODUCT_DETAILS",LOW,,"verkleinert optisch die Brüste, Entlastung der Schultern, vergrößert optisch die Brüste",,"Entlastung der Schultern, vergrößert optisch die Brüste, verkleinert optisch die Brüste",
Größenhinweis,Maßangaben,STRING,False,PRODUCT_DETAILS,LOW,,"Fällt klein aus, bitte eine Größe größer bestellen., Fällt eng aus, bitte eine Größe größer bestellen., Fällt groß aus, bitte eine Größe kleiner bestellen., Cup fällt klein aus, bitte ein Cup größer bestellen., Fällt sehr weit aus, bitte zwei Größen kleiner bestellen.",,,
Applikationen,Optik/Stil,STRING,True,PRODUCT_DETAILS,LOW,,"Logodruck, Logoschriftzug, Schleife, Logoschriftzüge, Mesheinsatz",,,
Materialzusammensetzung,Material,STRING,True,"LEGAL, PRODUCT_DETAILS",HIGH,,"Obermaterial: 60% Polyamid, 35% Polyester, 5% Elasthan, 85% polyester/15% elastane, Obermaterial: 90% Polyamid, 10% Elasthan, 91% Polyester/9% Elasthan, 85% Recyceltes Polyester/15% Elasthan",,,
Farbe Packstück 2,Farbe,STRING,False,"VARIATION_THEME, PRODUCT_DETAILS",LOW,,"weiß, schwarz, creme, puder, meliert",,,
Bügel,Körbchen / Cup,STRING,True,"FILTER, NAVIGATION, SEARCH, PRODUCT_DETAILS",LOW,,"mit Bügel, ohne Bügel, mit seitlichen Stäbchen",,"ohne Bügel, mit Bügel",
Besondere Merkmale,Artikelbezeichnung,STRING,False,TITLE,LOW,,"mit Bügel, ohne Bügel, mit Vorderverschluss, Clima;RDY;DESIGNED4TRAINING, mit nahtlos vorgeformten Cups",,,
US-Größen (Große Größen),Größensystem,STRING,True,,LOW,,,"4X, 3X, 2X, 1X, 0X",,
Art Push-up-Effekt,Körbchen / Cup,STRING,True,PRODUCT_DETAILS,LOW,,"mit integriertem Kissen, mit herausnehmbaren Kissen, mit herausnehmbarer Vollschale, durch besondere Schnittform, variabler Push-up Effekt",,,
Set-Info,Artikelbezeichnung,STRING,True,NAVIGATION,LOW,,"2 Stück, 3 Stück, 2er-Pack, 3er-Pack, mit Schal und Mütze",,"3 Stück, 5er-Pack, 2 Stück, 4 Stück, 2er-Pack, 3er-Pack",
Unterbrustumfang,Größensystem,STRING,False,"VARIATION_THEME, TOPINFO, FILTER",MEDIUM,,,"130, 120, 110, 100, 135, 125, 115, 105, 90, 80, 70, 95, 85, 75, 65",,
Serie Technischer Name,Serie,STRING,False,,LOW,,"WB#OT3SS 80720-PerfectBasic, WB#MK20-08-2019-SF-136, MS#003048 active by LASCANA, WB#MK20-08-2019-CS-112, WB#MK20-08-2019-CS-149",,,
Verschluss,Verschluss,STRING,False,PRODUCT_DETAILS,LOW,,"Haken & Ösen, ohne Verschluss, Haken, Gummizug, Reißverschluss",,,
Ausgabegröße,Maßangaben,STRING,False,VARIATION_THEME,MEDIUM,,"L, S, M, XS, XL",,,
Cupdetails,Körbchen / Cup,STRING,True,"FILTER, NAVIGATION, SEARCH, PRODUCT_DETAILS",LOW,,"mit Schale, nahtlos vorgeformt, herausnehmbar, nicht gefüttert, gefüttert",,"nicht herausnehmbar, herausnehmbar, nahtlos vorgeformt, mit Schale, Spacer, nicht gefüttert, gefüttert",
Normalgrößen,Größensystem,INTEGER,True,FILTER,LOW,,,"44, 66, 34, 56, 78, 46, 68, 36, 58, 48, 38, 70, 60, 50, 72, 40, 62, 30, 52, 74, 42, 64, 32, 54",,
Material,Material,STRING,False,"VARIATION_THEME, FILTER, NAVIGATION, SEARCH",HIGH,,"Materialmix, Kunstfaser, Polyamid, Baumwollmischung, Baumwolle",,"Daune, Baumwolle, Elasthan, Baumwollmischung",
Grundfarbe,Farbe,STRING,True,"FILTER, NAVIGATION",HIGH,,,"lila, gelb, natur, schwarz, grün, silberfarben, grau, blau, braun, orange, weiß, goldfarben, rot, bunt, rosa",,
Stil,Optik/Stil,STRING,False,"FILTER, NAVIGATION, SEARCH, PRODUCT_DETAILS",MEDIUM,,"sportlich, klassisch, feminin, casual, sexy",,"sportlich, klassisch, elegant",
Anlässe,Allgemein,STRING,True,NAVIGATION,MEDIUM,,"Sportmode, Dessous, Underwear, Basic, Erotik",,"Arbeitsmode, Festtagsmode, Dessous, Hochzeitsmode, Hochzeit, Sleepwear, Trachtenmode, Casualmode, Erotik, Fanmode, Businessmode, Abendmode",
Rückenteil,BH-Rückenteil,STRING,True,"NAVIGATION, PRODUCT_DETAILS",LOW,,"Racerbackrücken, normaler Rücken, Spitzenrücken, Ringerrücken, T-back",,"rückenfrei, transparent",
Zielgruppe,Allgemein,STRING,False,NAVIGATION,HIGH,,,"zielgruppenunabhängig, Babys, Jugendliche, Kinder, Erwachsene",,
Größentext,Größensystem,STRING,True,,HIGH,,"85, 80, 75, 90, 95",,,
Körbchengröße,Maßangaben,STRING,False,"VARIATION_THEME, TOPINFO",MEDIUM,,,"Cup D/DD, Cup A/B, Cup DD/E, Cup A/A, Cup D/E/F, Cup C/D, Cup B/C, Cup E/F, Cup A, Cup AA, Cup D/E, Cup G/H, Cup F/G, Cup H, Cup I, Cup F, Cup G, Cup D, Cup E, Cup B, Cup C, Cup L, Cup J, Cup K, Cup A/B/C, Cup DD, Cup AA/A",,
Materialeigenschaften,Material,STRING,True,"FILTER, NAVIGATION, SEARCH, PRODUCT_DETAILS",LOW,,"atmungsaktiv, Lycra, elastisch, wärmeisolierend, schnell trocknend",,"pflegeleicht, Lycra, schnell trocknend, wärmend, elastisch, wärmeisolierend, Stretch, kühlend, wasserdicht, wasserdampfdurchlässig, windabweisend, winddicht, Teflon beschichtet, nicht elastisch, schmutzabweisend, reflektierend, Easycare, bügelfrei, wasserabweisend, antibakteriell, atmungsaktiv, Pure Wear",
Geschlecht,Allgemein,STRING,False,NAVIGATION,HIGH,,,"neutral, männlich, weiblich",,
Sportart,Sportartdetails,STRING,True,"NAVIGATION, PRODUCT_DETAILS",LOW,,"Fitness, Leichtathletik, Yoga, Laufen, Tanzsport",,"Fußball, Rugby, Tennis, Boxen, Kampfsport, Schwimmen, Inlineskating, Badminton, Reiten, Jagdsport, Pilates, American Football, Basketball, Eishockey, Laufen, Baseball, Yoga, Skateboarding, Handball, Softball, Fitness",
Trägerdetails,BH-Träger,STRING,True,PRODUCT_DETAILS,LOW,,"verstellbar, elastisch, abnehmbar, breit, im Rücken gekreuzt",,,
Kompression,Funktionen,STRING,False,"FILTER, NAVIGATION, SEARCH, PRODUCT_DETAILS",LOW,,"keine, hoch, mittel, niedrig",,"keine, hoch, mittel, niedrig",
US-Größen,Größensystem,STRING,True,FILTER,LOW,,,"14XL, 12XL, 10XL, 4XL, 5XL, 6XL, 7XL, 8XL, L, 9XL, M, XXL, XXS, S, XL, XS, XXXL",,
Farbe,Farbe,STRING,False,"VARIATION_THEME, TOPINFO, PRODUCT_DETAILS",HIGH,,"schwarz, weiß, black, grau, rot",,,
Belastungsgrad,Funktionen,STRING,False,"FILTER, NAVIGATION, SEARCH, PRODUCT_DETAILS",LOW,,"mittel, leicht, stark",,"stark, leicht, mittel",
Träger,BH-Träger,STRING,True,"FILTER, NAVIGATION, SEARCH, PRODUCT_DETAILS",MEDIUM,,"mit Träger, Spaghettiträger, breite Träger, ohne Träger, Tanktopträger",,"transparente Träger, Doppelträger, Schmuckträger, Kreuzträger, Multiway-Träger, Sportträger, breite Träger, Spaghettiträger, ohne Träger, Entlastungsträger, one Shoulder, mit Träger, Tanktopträger, Neckholder, normale Träger",
US-Größen (Kinder),Größensystem,STRING,True,FILTER,LOW,,,"4XL, 5XL, L, 2XS, M, XXL, 3XS, XXS, XXXS, S, XL, XS, XXXL",,
UK-Größen,Größensystem,INTEGER,False,FILTER,LOW,,,"22, 44, 24, 46, 26, 48, 28, 50, 30, 52, 10, 32, 12, 34, 14, 36, 16, 38, 18, 2, 4, 6, 8, 40, 41, 20, 42",,
Pflegehinweise,Material,STRING,False,PRODUCT_DETAILS,HIGH,,"Maschinenwäsche, Handwäsche, Schonwäsche, 30°C Maschinenwäsche, 30°C Schonwäsche",,,
Anzahl Teile,Artikelbezeichnung,INTEGER,False,"VARIATION_THEME, FILTER, NAVIGATION, SEARCH",LOW,,,,"1, 2, 3, 6, 9",
Normalgrößen (Kinder),Größensystem,INTEGER,True,FILTER,LOW,,,"44, 68, 170, 152, 110, 176, 134, 158, 116, 92, 50, 74, 98, 56, 182, 140, 164, 122, 166, 188, 146, 168, 104, 128, 80, 40, 62, 86",,
