name,attributeGroup,type,multiValue,featureRelevance,relevance,description,exampleValues,allowedValues,recommendedValues,reference
Set-Info,Produktdetails,STRING,False,TITLE,LOW,,,,,
Hinweis Zubehör,Hinweise,STRING,True,PRODUCT_DETAILS,LOW,,"hartbodentaugliche Rollen, 2 davon feststellbar, Mit Feststellbremse, »FLAI Papier- und Zeitschriftenablage« Art Nummer 53791027, Mit Aussparung für Flaschen und einklappbarem Besteckfach, »FLAI Magnetboard mit Ablage« Art Nummer 51496634",,,
Herstellergarantie,Wissenswertes,STRING,False,PRODUCT_DETAILS,LOW,,"2 Jahre gemäß den Garantie-Bedingungen, 8  Jahre gemäß den Garantie-Bedingungen, 5 Jahre gemäß den Garantie-Bedingungen, 6 Jahre gemäß den Garantie-Bedingungen, 10 Jahre gemäß den Garantie-Bedingungen",,,
Sprachen Pflegezusatzinformation Produkt,Product Compliance,STRING,True,,LOW,,"Französisch (FR), Englisch (EN), Deutsch (DE), Niederländisch (NL), Italienisch (IT)",,,
Durchmesser,Maßangaben,FLOAT,False,"VARIATION_THEME, PRODUCT_DETAILS",LOW,,,,,
Set-Typ,Produktdetails,STRING,False,TITLE,LOW,,"Set, Spar-Set",,,
Gewicht,Maßangaben,FLOAT,False,PRODUCT_DETAILS,LOW,,,,,
Hinweis Lieferumfang,Lieferung & Montage,STRING,True,PRODUCT_DETAILS,LOW,,"Alles ca.-Maße, Alles ca.-Maße (inkl. Fußhöhe), Selbstmontage mit Aufbauanleitung, Aufbauanleitung, Montagematerial",,,
Serie Technischer Name,Serie,STRING,False,,LOW,,"Notio Küchenwagen, Gutmann Trolley, Maja Rantum, SIT RUSTIC, Mueller Plane",,,
Serie,Serie,STRING,False,PRODUCT_DETAILS,LOW,,"Trolley, Rustic, Mesh, LAVA line, Set+",,,
Art Herstellung,Wissenswertes,STRING,False,PRODUCT_DETAILS,LOW,,"maschinell, handgefertigt",,,
Oberflächenbearbeitung,Optik/Stil,STRING,False,"VARIATION_THEME, PRODUCT_DETAILS",LOW,,"poliert, veredelt, ummantelt, gefräst, geriffelt",,,
Besondere Merkmale,Produktdetails,STRING,False,TITLE,LOW,,"Shabby Chic, Vintage, Pflegeleichte Oberfläche, kratzfest durch Melaminharzbeschichtung, pflegeleichte Oberfläche, Rollwagen ""Ergil"" mit 3 Schubladen",,,
Wissenswertes,Wissenswertes,STRING,True,PRODUCT_DETAILS,LOW,,"Keine scharfen Reinigungsmittel verwenden, 1 versteckte Schublade, 3 Schubkästen, 1 Ablage, Mit vier Rollen und Feststellbremsen an den hinteren Rollen.",,,
Sprachen Warnhinweise,Product Compliance,STRING,True,,LOW,,"Französisch (FR), Englisch (EN), Deutsch (DE), Niederländisch (NL), Italienisch (IT)",,,
Markeninformationen,Produktdetails,STRING,False,PRODUCT_DETAILS,LOW,,"Seit 2001 begeistert uns Home affaire mit Landhausmöbeln zum Verlieben. Ob modern, romantisch oder natürlich traditionell – der Fantasie für wunderschönes Einrichten sind kaum Grenzen gesetzt., Das Repertoire der Gutmann Factory umfasst Möbeltrends aus aller Welt. Erlesene Massivholzmöbel aus handwerklicher Serienfertigung, Lifestylemöbel aus angesagten Trendmaterialien und Polstermöbel in außergewöhnlichen Dessins – all dies bringen unsere Lifestylespezialisten, durch ihre Reisen inspiriert, direkt zu Ihnen nach Hause., SMALL LIVING auf engstem Raum - Nicht nur New York oder London, auch in München, Freiburg und Berlin wird Wohnraum immer knapper und teurer. Mieten von 15 oder gar 20 Euro je Quadratmeter sind inzwischen längst keine Seltenheit mehr. Kein Wunder, dass viele Menschen nach kleineren Wohnungen suchen und dass kompaktes Wohnen in so genannten Mikro-Appartements nicht nur bei Student*innen voll im Trend liegt. Viele dieser neuen Wohnungen sind lediglich 20 bis 30 Quadratmeter groß, entsprechend wichtig werden daher intelligente Grundrissgestaltung sowie maximal komprimierte Innenausstattung.<br />Müller SMALL LIVING steht für zeitlos moderne Möbel, die insbesondere für das urbane Wohnen auf begrenzter Fläche konzipiert sind. Das Produktprogramm wird komplett am eigenen Firmensitz im friesischen Bockhorn gefertigt. Es umfasst multifunktionale, flexible und modular erweiterbare Möbel, die nicht nur in großen Altbau-Lofts, sondern auch in kleineren Wohnungen funktionieren. Das 1869 gegründete Familienunternehmen ist mittlerweile in fünfter Generation tätig. Seit Ende der 1960er-Jahre setzt Müller SMALL LIVING auf industrielle Serienproduktion und auf die Zusammenarbeit mit Designern wie Rolf Heide, Jan Armgardt, kaschkasch, Michael Hilgers oder Felix Stark. Bekannt ist insbesondere die gemeinsam mit Rolf Heide entwickelte Stapelliege., Leonique Home Couture: Inspiriert von Mode, Kunst, Architektur und Lifestyle übersetzt Leonique die Strömungen von Gegenwart und Vergangenheit in einzigartige Einrichtungsgegenstände – begleitet von einem Hauch an Luxus., Places of Style setzt Akzente für stilvolles und hochwertiges Wohnen. Klare Linien, durchdachtes Design und verlässliche Qualität. Die Marke, um moderne und stilvolle Wohnwelten zu schaffen.",,,
Wohnstil,Allgemein,STRING,True,PRODUCT_DETAILS,LOW,,"Modern, Landhaus, Scandi, Klassik, Shabby Chic",,,
Oberflächenbehandlung,Optik/Stil,STRING,False,"VARIATION_THEME, PRODUCT_DETAILS",LOW,,"geölt, lackiert, gewachst, gebeizt, antikisiert",,,
Art Füße,Ausstattung & Funktionen,STRING,False,PRODUCT_DETAILS,LOW,,"Rollen, Kunststoffgleiter, Teleskopfuß, Filzgleiter, Y-Fuß",,,
Oberflächenoptik,Optik/Stil,STRING,False,"VARIATION_THEME, PRODUCT_DETAILS",LOW,,"matt, hochglänzend, Klavierlackoptik, glänzend, seidenmatt",,,
Eigenschaften,Produktdetails,STRING,True,PRODUCT_DETAILS,LOW,,"klappbar, höhenverstellbar",,,
Materialeigenschaften,Material,STRING,True,PRODUCT_DETAILS,LOW,,"rostfrei, witterungsbeständig, UV-beständig",,,
Holzart,Material,STRING,False,"VARIATION_THEME, PRODUCT_DETAILS",LOW,,"Eukalyptus, Kiefer, Akazie, Bambus, Birke",,,
Materialzusammensetzung,Material,STRING,False,PRODUCT_DETAILS,LOW,,100% Bambus,,,
Anzahl Schubladen,Produktdetails,INTEGER,False,"VARIATION_THEME, PRODUCT_DETAILS",LOW,,,,,
Ergänzende Maßangaben,Maßangaben,STRING,False,PRODUCT_DETAILS,LOW,,"Schubkasteninnenmaß: B/H/T= 32/9/34cm, Maße H 62 ohne Rollen; H 67 mit Rollen x B 29 x T 39cm, Schubladeninnenmaß (B/T/H): 2x31/40/8,5 cm; 31/35/8,5 cm, 4 Rollen (Höhe 9 cm) Schubkasteninnenmaße (B/T/H): oben ca. 41/28/7 cm, unten ca. 41/28/13,5 cm, Innenmaß Schubkasten: ca. 33,5 x 42,7 x 12,4 cm (B/T/H)",,,
Form Tisch,Produktdetails,STRING,False,PRODUCT_DETAILS,LOW,,"rechteckig, rund, oval",,,
Oberflächenbeschichtung,Optik/Stil,STRING,False,"VARIATION_THEME, PRODUCT_DETAILS",LOW,,"pulverbeschichtet, melaminharzbeschichtet, melaminbeschichtet, verchromt, Papierbeschichtung",,,
Aufbauhinweise,Lieferung & Montage,STRING,False,PRODUCT_DETAILS,LOW,,"Selbstmontage mit Aufbauanleitung, Inklusive Aufbau – und Premiumservice, teilmontiert, fertig montiert",,,
Anzahl Einlegeböden,Produktdetails,INTEGER,False,PRODUCT_DETAILS,LOW,,,,,
Lieferzustand,Lieferung & Montage,STRING,False,PRODUCT_DETAILS,LOW,,"zerlegt, montiert, teilmontiert, teilmontiert, nur Füße zu montieren, teilmontiert, nur einhaken und Füße montieren",,,
Farbe,Farbe,STRING,False,"VARIATION_THEME, TOPINFO, PRODUCT_DETAILS",HIGH,,"weiß, silberfarben, schwarz, natur, grau",,,
Höhe,Maßangaben,FLOAT,False,"VARIATION_THEME, PRODUCT_DETAILS",HIGH,,,,,
Anzahl Teile,Produktdetails,INTEGER,False,"TITLE, VARIATION_THEME",LOW,,,,,
Relevanz Batteriegesetz,Product Compliance,STRING,False,,LOW,,"Produkt fällt nicht unter das Batteriegesetz, Produkt fällt unter das Batteriegesetz",,,
CE-Kennzeichnung am Produkt,Product Compliance,STRING,False,,LOW,,"Produkt verfügt nicht über eine CE-Kennzeichnung, Produkt verfügt über eine CE-Kennzeichnung",,,
Hinweis Maßangaben,Maßangaben,STRING,False,PRODUCT_DETAILS,LOW,,Alle Angaben sind ca.-Maße.,,,
Breite,Maßangaben,FLOAT,False,"VARIATION_THEME, PRODUCT_DETAILS",HIGH,,,,,
Sprachen Bedienungs-/Aufbauanleitung,Product Compliance,STRING,True,,LOW,,"Deutsch (DE), Aufbauanleitung ausschließlich durch Zeichnung ausgeführt, Französisch (FR), Englisch (EN), Italienisch (IT)",,,
Relevanz Energieverbrauchskennzeichnungsverordnung,Product Compliance,STRING,False,,LOW,,"Produkt fällt nicht unter die Energieverbrauchskennzeichnungsverordnung, Produkt fällt unter die Energieverbrauchskennzeichnungsverordnung",,,
Material,Material,STRING,False,"VARIATION_THEME, FILTER, PRODUCT_DETAILS",MEDIUM,,"Metall, Holzwerkstoff, Kunststoff, Melamin, Stahl",,,
Grundfarbe,Farbe,STRING,True,FILTER,HIGH,,,"lila, gelb, natur, schwarz, grün, silberfarben, grau, blau, braun, orange, weiß, goldfarben, rot, bunt, rosa",,
Zielgruppe,Allgemein,STRING,True,NAVIGATION,LOW,,,"zielgruppenunabhängig, Babys, Jugendliche, Kinder, Erwachsene",,
Wohnraum,Allgemein,STRING,True,,MEDIUM,,"Küche, Arbeitszimmer, Wohnzimmer, Esszimmer, Flur",,,
Herstelleradresse (EWR) am Produkt,Product Compliance,STRING,False,,LOW,,"Produkt verfügt über eine Kennzeichnung mit der Herstelleradresse (EWR), Produkt verfügt nicht über eine Kennzeichnung mit der Herstelleradresse (EWR), zu bearbeiten",,,
Sprachen am Produkt,Product Compliance,STRING,True,,LOW,,"Deutsch (DE), Englisch (EN), Französisch (FR), Italienisch (IT), Tschechisch (CS)",,,
Geschlecht,Allgemein,STRING,False,NAVIGATION,MEDIUM,,,"neutral, männlich, weiblich",,
Relevanz CE-Pflicht,Product Compliance,STRING,False,,LOW,,"Produkt fällt nicht unter die CE-Pflicht, Produkt fällt unter die CE-Pflicht",,,
Belastbarkeit maximal,Maßangaben,FLOAT,False,PRODUCT_DETAILS,LOW,,,,,
Ausstattung,Produktdetails,STRING,True,PRODUCT_DETAILS,LOW,,"Griff, Feststellbremse, Flaschenhalterung, abschließbare Fächer, abnehmbares Tablett",,,
Lieferumfang,Lieferung & Montage,STRING,True,PRODUCT_DETAILS,LOW,,"Montagematerial inklusive, Aufbauanleitung, Montagematerial, Mit Aufbauanleitung, Küchenrollwagen und Montagematerial",,,
Relevanz Gefahrgut,Product Compliance,STRING,False,,LOW,,"Produkt fällt nicht unter die Gefahrgutvorschriften., Produkt fällt unter die Gefahrgutvorschriften., Produkt fällt unter die Gefahrgutvorschriften gemäß Sicherheitsdatenblatt (Abschnitt 14).",,,
Relevanz WEEE-Richtlinie,Product Compliance,STRING,False,,LOW,,"Produkt fällt nicht unter die WEEE-Richtlinie, Produkt fällt unter die WEEE-Richtlinie",,,
Typ Netzstecker,Product Compliance,STRING,False,,LOW,,"kein Netzanschluss vorhanden, Netzdirektanschluss, CEE-Drehstromstecker, Schutzkontaktstecker (Typ F-CEE 7/4), Konturenstecker (Typ C-CEE 7/17)",,,
Produktkennzeichnungen,Product Compliance,STRING,True,,LOW,,"Artikelnummer, Chargennummer, Seriennummer, Typennummer, Kennnummer der Partie",,,
Pflegehinweise,Hinweise,STRING,True,PRODUCT_DETAILS,LOW,,"feucht abwischbar, Bitte beachten Sie die Pflegehinweise gemäß dem beiliegenden Produkt- und Materialpass., pflegeleicht, trocken abwischbar",,,
Tiefe,Maßangaben,FLOAT,False,"VARIATION_THEME, PRODUCT_DETAILS",HIGH,,,,,
